{
  "config_hash": "15e3f10c606eae57fc7372366cdde05fd98e43942e9c7a69e44eb9d5a7b95ac4",
  "created_at": "2026-10-12T06:08:19.820642Z",
  "dataset_hash": "2776a91c18677490587332d69d993e0811f25289947ddca9639493b9648a84d7",
  "metrics": {
    "canonical.dev.anomaly.ambiguous_hypothesis_rate": null,
    "canonical.dev.anomaly.ambiguous_hypothesis_rate.denominator": 0.0,
    "canonical.dev.anomaly.ambiguous_hypothesis_rate.numerator": 0.0,
    "canonical.dev.anomaly.answered_coverage": 0.8333333333333334,
    "canonical.dev.anomaly.answered_coverage.denominator": 6.0,
    "canonical.dev.anomaly.answered_coverage.numerator": 5.0,
    "canonical.dev.anomaly.answered_identifiable_top1_error": 0.0,
    "canonical.dev.anomaly.answered_identifiable_top1_error.denominator": 5.0,
    "canonical.dev.anomaly.answered_identifiable_top1_error.numerator": 0.0,
    "canonical.dev.anomaly.candidate_recall": 1.0,
    "canonical.dev.anomaly.candidate_recall.denominator": 5.0,
    "canonical.dev.anomaly.candidate_recall.numerator": 5.0,
    "canonical.dev.anomaly.citation_validity": 1.0,
    "canonical.dev.anomaly.citation_validity.denominator": 15.0,
    "canonical.dev.anomaly.citation_validity.numerator": 15.0,
    "canonical.dev.anomaly.conditional_hit_at_1": 1.0,
    "canonical.dev.anomaly.conditional_hit_at_1.denominator": 5.0,
    "canonical.dev.anomaly.conditional_hit_at_1.numerator": 5.0,
    "canonical.dev.anomaly.conditional_hit_at_3": 1.0,
    "canonical.dev.anomaly.conditional_hit_at_3.denominator": 5.0,
    "canonical.dev.anomaly.conditional_hit_at_3.numerator": 5.0,
    "canonical.dev.anomaly.episodes": 6.0,
    "canonical.dev.anomaly.exposed_hit1_identifiable": 1.0,
    "canonical.dev.anomaly.exposed_hit1_identifiable.denominator": 5.0,
    "canonical.dev.anomaly.exposed_hit1_identifiable.numerator": 5.0,
    "canonical.dev.anomaly.healthy_hypothesis_rate": 0.0,
    "canonical.dev.anomaly.healthy_hypothesis_rate.denominator": 1.0,
    "canonical.dev.anomaly.healthy_hypothesis_rate.numerator": 0.0,
    "canonical.dev.anomaly.hit_at_1": 1.0,
    "canonical.dev.anomaly.hit_at_1.denominator": 5.0,
    "canonical.dev.anomaly.hit_at_1.numerator": 5.0,
    "canonical.dev.anomaly.hit_at_3": 1.0,
    "canonical.dev.anomaly.hit_at_3.denominator": 5.0,
    "canonical.dev.anomaly.hit_at_3.numerator": 5.0,
    "canonical.dev.anomaly.identifiable_faults": 5.0,
    "canonical.dev.anomaly.mrr": 1.0,
    "canonical.dev.anomaly.numeric_consistency": 1.0,
    "canonical.dev.anomaly.numeric_consistency.denominator": 15.0,
    "canonical.dev.anomaly.numeric_consistency.numerator": 15.0,
    "canonical.dev.dense.ambiguous_hypothesis_rate": null,
    "canonical.dev.dense.ambiguous_hypothesis_rate.denominator": 0.0,
    "canonical.dev.dense.ambiguous_hypothesis_rate.numerator": 0.0,
    "canonical.dev.dense.answered_coverage": 0.8333333333333334,
    "canonical.dev.dense.answered_coverage.denominator": 6.0,
    "canonical.dev.dense.answered_coverage.numerator": 5.0,
    "canonical.dev.dense.answered_identifiable_top1_error": 1.0,
    "canonical.dev.dense.answered_identifiable_top1_error.denominator": 5.0,
    "canonical.dev.dense.answered_identifiable_top1_error.numerator": 5.0,
    "canonical.dev.dense.candidate_recall": 0.0,
    "canonical.dev.dense.candidate_recall.denominator": 5.0,
    "canonical.dev.dense.candidate_recall.numerator": 0.0,
    "canonical.dev.dense.citation_validity": 1.0,
    "canonical.dev.dense.citation_validity.denominator": 11.0,
    "canonical.dev.dense.citation_validity.numerator": 11.0,
    "canonical.dev.dense.conditional_hit_at_1": null,
    "canonical.dev.dense.conditional_hit_at_1.denominator": 0.0,
    "canonical.dev.dense.conditional_hit_at_1.numerator": 0.0,
    "canonical.dev.dense.conditional_hit_at_3": null,
    "canonical.dev.dense.conditional_hit_at_3.denominator": 0.0,
    "canonical.dev.dense.conditional_hit_at_3.numerator": 0.0,
    "canonical.dev.dense.episodes": 6.0,
    "canonical.dev.dense.exposed_hit1_identifiable": 0.0,
    "canonical.dev.dense.exposed_hit1_identifiable.denominator": 5.0,
    "canonical.dev.dense.exposed_hit1_identifiable.numerator": 0.0,
    "canonical.dev.dense.healthy_hypothesis_rate": 0.0,
    "canonical.dev.dense.healthy_hypothesis_rate.denominator": 1.0,
    "canonical.dev.dense.healthy_hypothesis_rate.numerator": 0.0,
    "canonical.dev.dense.hit_at_1": 0.0,
    "canonical.dev.dense.hit_at_1.denominator": 5.0,
    "canonical.dev.dense.hit_at_1.numerator": 0.0,
    "canonical.dev.dense.hit_at_3": 0.0,
    "canonical.dev.dense.hit_at_3.denominator": 5.0,
    "canonical.dev.dense.hit_at_3.numerator": 0.0,
    "canonical.dev.dense.identifiable_faults": 5.0,
    "canonical.dev.dense.mrr": 0.0,
    "canonical.dev.dense.numeric_consistency": 1.0,
    "canonical.dev.dense.numeric_consistency.denominator": 10.0,
    "canonical.dev.dense.numeric_consistency.numerator": 10.0,
    "canonical.dev.graph_heuristic.ambiguous_hypothesis_rate": null,
    "canonical.dev.graph_heuristic.ambiguous_hypothesis_rate.denominator": 0.0,
    "canonical.dev.graph_heuristic.ambiguous_hypothesis_rate.numerator": 0.0,
    "canonical.dev.graph_heuristic.answered_coverage": 0.8333333333333334,
    "canonical.dev.graph_heuristic.answered_coverage.denominator": 6.0,
    "canonical.dev.graph_heuristic.answered_coverage.numerator": 5.0,
    "canonical.dev.graph_heuristic.answered_identifiable_top1_error": 0.8,
    "canonical.dev.graph_heuristic.answered_identifiable_top1_error.denominator": 5.0,
    "canonical.dev.graph_heuristic.answered_identifiable_top1_error.numerator": 4.0,
    "canonical.dev.graph_heuristic.candidate_recall": 1.0,
    "canonical.dev.graph_heuristic.candidate_recall.denominator": 5.0,
    "canonical.dev.graph_heuristic.candidate_recall.numerator": 5.0,
    "canonical.dev.graph_heuristic.citation_validity": 1.0,
    "canonical.dev.graph_heuristic.citation_validity.denominator": 16.0,
    "canonical.dev.graph_heuristic.citation_validity.numerator": 16.0,
    "canonical.dev.graph_heuristic.conditional_hit_at_1": 0.2,
    "canonical.dev.graph_heuristic.conditional_hit_at_1.denominator": 5.0,
    "canonical.dev.graph_heuristic.conditional_hit_at_1.numerator": 1.0,
    "canonical.dev.graph_heuristic.conditional_hit_at_3": 1.0,
    "canonical.dev.graph_heuristic.conditional_hit_at_3.denominator": 5.0,
    "canonical.dev.graph_heuristic.conditional_hit_at_3.numerator": 5.0,
    "canonical.dev.graph_heuristic.episodes": 6.0,
    "canonical.dev.graph_heuristic.exposed_hit1_identifiable": 0.2,
    "canonical.dev.graph_heuristic.exposed_hit1_identifiable.denominator": 5.0,
    "canonical.dev.graph_heuristic.exposed_hit1_identifiable.numerator": 1.0,
    "canonical.dev.graph_heuristic.healthy_hypothesis_rate": 0.0,
    "canonical.dev.graph_heuristic.healthy_hypothesis_rate.denominator": 1.0,
    "canonical.dev.graph_heuristic.healthy_hypothesis_rate.numerator": 0.0,
    "canonical.dev.graph_heuristic.hit_at_1": 0.2,
    "canonical.dev.graph_heuristic.hit_at_1.denominator": 5.0,
    "canonical.dev.graph_heuristic.hit_at_1.numerator": 1.0,
    "canonical.dev.graph_heuristic.hit_at_3": 1.0,
    "canonical.dev.graph_heuristic.hit_at_3.denominator": 5.0,
    "canonical.dev.graph_heuristic.hit_at_3.numerator": 5.0,
    "canonical.dev.graph_heuristic.identifiable_faults": 5.0,
    "canonical.dev.graph_heuristic.mrr": 0.5,
    "canonical.dev.graph_heuristic.numeric_consistency": 1.0,
    "canonical.dev.graph_heuristic.numeric_consistency.denominator": 15.0,
    "canonical.dev.graph_heuristic.numeric_consistency.numerator": 15.0,
    "canonical.dev.graph_learned.ambiguous_hypothesis_rate": null,
    "canonical.dev.graph_learned.ambiguous_hypothesis_rate.denominator": 0.0,
    "canonical.dev.graph_learned.ambiguous_hypothesis_rate.numerator": 0.0,
    "canonical.dev.graph_learned.answered_coverage": 0.0,
    "canonical.dev.graph_learned.answered_coverage.denominator": 6.0,
    "canonical.dev.graph_learned.answered_coverage.numerator": 0.0,
    "canonical.dev.graph_learned.answered_identifiable_top1_error": null,
    "canonical.dev.graph_learned.answered_identifiable_top1_error.denominator": 0.0,
    "canonical.dev.graph_learned.answered_identifiable_top1_error.numerator": 0.0,
    "canonical.dev.graph_learned.candidate_recall": 1.0,
    "canonical.dev.graph_learned.candidate_recall.denominator": 5.0,
    "canonical.dev.graph_learned.candidate_recall.numerator": 5.0,
    "canonical.dev.graph_learned.citation_validity": 1.0,
    "canonical.dev.graph_learned.citation_validity.denominator": 1.0,
    "canonical.dev.graph_learned.citation_validity.numerator": 1.0,
    "canonical.dev.graph_learned.conditional_hit_at_1": 0.0,
    "canonical.dev.graph_learned.conditional_hit_at_1.denominator": 5.0,
    "canonical.dev.graph_learned.conditional_hit_at_1.numerator": 0.0,
    "canonical.dev.graph_learned.conditional_hit_at_3": 1.0,
    "canonical.dev.graph_learned.conditional_hit_at_3.denominator": 5.0,
    "canonical.dev.graph_learned.conditional_hit_at_3.numerator": 5.0,
    "canonical.dev.graph_learned.episodes": 6.0,
    "canonical.dev.graph_learned.exposed_hit1_identifiable": 0.0,
    "canonical.dev.graph_learned.exposed_hit1_identifiable.denominator": 5.0,
    "canonical.dev.graph_learned.exposed_hit1_identifiable.numerator": 0.0,
    "canonical.dev.graph_learned.healthy_hypothesis_rate": 0.0,
    "canonical.dev.graph_learned.healthy_hypothesis_rate.denominator": 1.0,
    "canonical.dev.graph_learned.healthy_hypothesis_rate.numerator": 0.0,
    "canonical.dev.graph_learned.hit_at_1": 0.0,
    "canonical.dev.graph_learned.hit_at_1.denominator": 5.0,
    "canonical.dev.graph_learned.hit_at_1.numerator": 0.0,
    "canonical.dev.graph_learned.hit_at_3": 1.0,
    "canonical.dev.graph_learned.hit_at_3.denominator": 5.0,
    "canonical.dev.graph_learned.hit_at_3.numerator": 5.0,
    "canonical.dev.graph_learned.identifiable_faults": 5.0,
    "canonical.dev.graph_learned.mrr": 0.5,